{
  "$schema": "https://json-schema.org/draft/2020-12/schema",
  "$id": "https://chenle02.github.io/total-coloring-data/schemas/dataset-manifest-v1.schema.json",
  "title": "Total Coloring Dataset Manifest",
  "description": "Complete inventory and provenance for one curated dataset release.",
  "type": "object",
  "additionalProperties": false,
  "required": [
    "$schema",
    "schema_version",
    "dataset",
    "release",
    "managed_roots",
    "artifacts"
  ],
  "properties": {
    "$schema": {
      "const": "schemas/dataset-manifest-v1.schema.json"
    },
    "schema_version": {
      "const": "1.0.0"
    },
    "dataset": {
      "type": "object",
      "additionalProperties": false,
      "required": ["id", "title", "license", "repository"],
      "properties": {
        "id": {
          "type": "string",
          "pattern": "^[a-z0-9]+(?:-[a-z0-9]+)*$"
        },
        "title": {
          "type": "string",
          "minLength": 1
        },
        "license": {
          "const": "CC-BY-4.0"
        },
        "repository": {
          "type": "string",
          "format": "uri"
        }
      }
    },
    "release": {
      "type": "object",
      "additionalProperties": false,
      "required": [
        "version",
        "status",
        "created_utc",
        "code_repository",
        "code_commit"
      ],
      "properties": {
        "version": {
          "type": "string",
          "pattern": "^[0-9]+\\.[0-9]+\\.[0-9]+(?:-[0-9A-Za-z.-]+)?$"
        },
        "status": {
          "enum": ["development", "candidate", "published"]
        },
        "created_utc": {
          "type": "string",
          "format": "utc-date-time"
        },
        "code_repository": {
          "type": "string",
          "format": "uri"
        },
        "code_commit": {
          "type": "string",
          "pattern": "^(?:UNSET|(?!0{40}$)[0-9a-f]{40})$"
        }
      }
    },
    "managed_roots": {
      "type": "array",
      "const": ["reports", "results"]
    },
    "artifacts": {
      "type": "array",
      "items": {
        "type": "object",
        "additionalProperties": false,
        "required": [
          "path",
          "role",
          "media_type",
          "bytes",
          "sha256",
          "description"
        ],
        "properties": {
          "path": {
            "type": "string",
            "format": "relative-path"
          },
          "role": {
            "enum": ["result", "report", "certificate", "fixture"]
          },
          "media_type": {
            "type": "string",
            "minLength": 1
          },
          "bytes": {
            "type": "integer",
            "minimum": 0
          },
          "sha256": {
            "type": "string",
            "format": "sha256"
          },
          "schema": {
            "type": "string",
            "format": "relative-path"
          },
          "records": {
            "type": "integer",
            "minimum": 0
          },
          "description": {
            "type": "string",
            "minLength": 1
          }
        }
      }
    }
  }
}
